{
  "analyzer_executions": [
    {
      "analyzer_execution_id": "core_analyzer_execution_e33c70dbb24653a870de743f",
      "analyzer_id": "java-storage-usage-analyzer",
      "analyzer_version": "0.44.0",
      "artifact_ids": [
        "storage_usage_8a9cbbe2e9df5497c4f887e2"
      ],
      "attempts": [
        {
          "attempt": 1,
          "process": {
            "command": [
              "/mnt/data/work-next/e2e-storage-sql/core-command",
              "evidence-execute",
              "--repository",
              "/mnt/data/work-next/e2e-storage-sql/repository",
              "--request",
              "/mnt/data/work-next/e2e-storage-sql/execution/execution-nodes/001-analyzer-java-storage-usage-analyzer-demo-repository/core-evidence-execution-request.json",
              "--output",
              "/mnt/data/work-next/e2e-storage-sql/execution/execution-nodes/001-analyzer-java-storage-usage-analyzer-demo-repository/core-evidence",
              "--repo-id",
              "demo-repository"
            ],
            "command_display": "/mnt/data/work-next/e2e-storage-sql/core-command evidence-execute --repository /mnt/data/work-next/e2e-storage-sql/repository --request /mnt/data/work-next/e2e-storage-sql/execution/execution-nodes/001-analyzer-java-storage-usage-analyzer-demo-repository/core-evidence-execution-request.json --output /mnt/data/work-next/e2e-storage-sql/execution/execution-nodes/001-analyzer-java-storage-usage-analyzer-demo-repository/core-evidence --repo-id demo-repository",
            "elapsed_seconds": 1.001,
            "log": "logs/core-evidence.log",
            "max_rss_kb": 123052,
            "returncode": 0,
            "stack_dump_requests": 0,
            "timed_out": false
          },
          "status": "completed"
        }
      ],
      "parameters": {},
      "request_provenance": {
        "core_evidence_catalog_fingerprint": "de0868da7b0f9e835a20d894b07e47822f7eb26d72d3e0d69fe5022a9b9c2c80",
        "execution_node_id": "analyzer:java-storage-usage-analyzer:demo-repository",
        "knowledge_execution_plan_fingerprint": "2dbda3f9699f2e6143d6bad5fcd0026942145e288ffd62ec6dcef1a4124f5a39",
        "knowledge_profile_id": "storage-and-sql",
        "semantic_role": "execution_request_provenance_only"
      },
      "required_by": [
        "observed-storage-usage"
      ],
      "semantic_outputs": [
        {
          "artifact_kind": "storage-usage-evidence",
          "schema_version": "storage-usage-evidence/v1"
        }
      ],
      "source_snapshot_fingerprints": [
        "bc474fae3e8cd59aadbf257f318f1e81c3327711c53b973804c9beb27aeeab2c"
      ],
      "source_snapshot_ids": [
        "demo-repository"
      ],
      "status": "completed"
    },
    {
      "analyzer_execution_id": "core_analyzer_execution_369c84e260fe38a0e77b44b5",
      "analyzer_id": "sql-analysis-analyzer",
      "analyzer_version": "0.44.0",
      "artifact_ids": [
        "sql_analysis_21e03484f6fe4b138810bd66"
      ],
      "attempts": [
        {
          "attempt": 1,
          "process": {
            "command": [
              "/mnt/data/work-next/e2e-storage-sql/core-command",
              "evidence-execute",
              "--repository",
              "/mnt/data/work-next/e2e-storage-sql/repository",
              "--request",
              "/mnt/data/work-next/e2e-storage-sql/execution/execution-nodes/002-analyzer-sql-analysis-analyzer-demo-repository/core-evidence-execution-request.json",
              "--output",
              "/mnt/data/work-next/e2e-storage-sql/execution/execution-nodes/002-analyzer-sql-analysis-analyzer-demo-repository/core-evidence",
              "--repo-id",
              "demo-repository"
            ],
            "command_display": "/mnt/data/work-next/e2e-storage-sql/core-command evidence-execute --repository /mnt/data/work-next/e2e-storage-sql/repository --request /mnt/data/work-next/e2e-storage-sql/execution/execution-nodes/002-analyzer-sql-analysis-analyzer-demo-repository/core-evidence-execution-request.json --output /mnt/data/work-next/e2e-storage-sql/execution/execution-nodes/002-analyzer-sql-analysis-analyzer-demo-repository/core-evidence --repo-id demo-repository",
            "elapsed_seconds": 1.001,
            "log": "logs/core-evidence.log",
            "max_rss_kb": 115648,
            "returncode": 0,
            "stack_dump_requests": 0,
            "timed_out": false
          },
          "status": "completed"
        }
      ],
      "parameters": {},
      "request_provenance": {
        "core_evidence_catalog_fingerprint": "de0868da7b0f9e835a20d894b07e47822f7eb26d72d3e0d69fe5022a9b9c2c80",
        "execution_node_id": "analyzer:sql-analysis-analyzer:demo-repository",
        "knowledge_execution_plan_fingerprint": "2dbda3f9699f2e6143d6bad5fcd0026942145e288ffd62ec6dcef1a4124f5a39",
        "knowledge_profile_id": "storage-and-sql",
        "semantic_role": "execution_request_provenance_only"
      },
      "required_by": [
        "sql-source-inventory"
      ],
      "semantic_outputs": [
        {
          "artifact_kind": "sql-analysis",
          "schema_version": "sql-analysis/v1"
        }
      ],
      "source_snapshot_fingerprints": [
        "2b2bace351367f43af333db56d3decd652e48cf850474e90acf6fc58cca76755"
      ],
      "source_snapshot_ids": [
        "demo-repository"
      ],
      "status": "completed"
    }
  ],
  "catalogs": {
    "core_evidence_contract_catalog_fingerprint": "de0868da7b0f9e835a20d894b07e47822f7eb26d72d3e0d69fe5022a9b9c2c80",
    "knowledge_materialization_catalog_fingerprint": "205958d7081ba11d2038ec9edfb147004d855ab12afce59d4fc7b8671c462120"
  },
  "completed_at": "2026-08-06T02:37:38.644924+00:00",
  "diagnostics": [],
  "evidence_artifacts": [
    {
      "artifact_id": "storage_usage_8a9cbbe2e9df5497c4f887e2",
      "artifact_kind": "storage-usage-evidence",
      "content_fingerprint": "8a9cbbe2e9df5497c4f887e272112d983a83c283b4f793858ec2a303750b6521",
      "contract_version": "core_evidence_artifact_contract/v1",
      "coverage": {
        "access_kind_counts": {
          "read": 1,
          "write": 1
        },
        "coverage_status": "complete",
        "java_files_discovered": 1,
        "java_methods_indexed": 4,
        "storage_access_count": 2,
        "storage_gap_count": 0,
        "storage_kind_counts": {
          "repository_or_storage_api": 2
        },
        "storage_read_count": 1,
        "storage_write_count": 1
      },
      "diagnostics": {
        "code_counts": {},
        "count": 0,
        "severity_counts": {}
      },
      "location": {
        "bytes": 5857,
        "kind": "file",
        "path": "/mnt/data/work-next/e2e-storage-sql/execution/execution-nodes/001-analyzer-java-storage-usage-analyzer-demo-repository/core-evidence/evidence/storage-usage-evidence.json",
        "sha256": "97ac7859a18844e9d0e1a5578e61601d2f063300a20e09ba08b574e7e8160728"
      },
      "producer_analyzer_execution_id": "core_analyzer_execution_e33c70dbb24653a870de743f",
      "provenance": {
        "core_artifact_provenance": {
          "execution_runtime": "core_evidence_runtime/v1",
          "inference_policy": "observed_calls_only_no_physical_name_guessing",
          "observation_source": "code_analyzer_core.scanners.java_call_observations._build_storage_facts",
          "parser_provider": "tree_sitter",
          "semantic_routing": "artifact_kind_plus_schema_version"
        },
        "core_execution_result": "core-evidence/core-evidence-execution-result.json",
        "foundation": {
          "contract_version": null,
          "fingerprint": null,
          "sections": [],
          "used": false
        },
        "producer": {
          "analyzer_id": "java-storage-usage-analyzer",
          "analyzer_version": "0.44.0",
          "component": "code-analyzer-core"
        },
        "request": {
          "core_evidence_catalog_fingerprint": "de0868da7b0f9e835a20d894b07e47822f7eb26d72d3e0d69fe5022a9b9c2c80",
          "execution_node_id": "analyzer:java-storage-usage-analyzer:demo-repository",
          "knowledge_execution_plan_fingerprint": "2dbda3f9699f2e6143d6bad5fcd0026942145e288ffd62ec6dcef1a4124f5a39",
          "knowledge_profile_id": "storage-and-sql",
          "semantic_role": "execution_request_provenance_only"
        },
        "required_by": [
          "observed-storage-usage"
        ],
        "source_snapshot": {
          "file_count": 1,
          "fingerprint": "bc474fae3e8cd59aadbf257f318f1e81c3327711c53b973804c9beb27aeeab2c",
          "revision": null,
          "scope": "java_storage_usage_sources",
          "source_id": "demo-repository"
        }
      },
      "registration_manifest_path": "/mnt/data/work-next/e2e-storage-sql/execution/execution-nodes/001-analyzer-java-storage-usage-analyzer-demo-repository/repository_analysis_run_manifest.json",
      "repo_id": "demo-repository",
      "schema_version": "storage-usage-evidence/v1",
      "semantic_identity": {
        "artifact_kind": "storage-usage-evidence",
        "schema_version": "storage-usage-evidence/v1"
      },
      "status": "completed"
    },
    {
      "artifact_id": "sql_analysis_21e03484f6fe4b138810bd66",
      "artifact_kind": "sql-analysis",
      "content_fingerprint": "21e03484f6fe4b138810bd66f1a38a4b12117e7fb3813d31ad074ef1e2e7015d",
      "contract_version": "core_evidence_artifact_contract/v1",
      "coverage": {
        "coverage_status": "complete",
        "lineage_gap_count": 0,
        "sql_files_scanned": 2,
        "sql_statement_count": 1,
        "sql_unit_count": 1
      },
      "diagnostics": {
        "code_counts": {},
        "count": 0,
        "severity_counts": {}
      },
      "location": {
        "bytes": 7184,
        "kind": "file",
        "path": "/mnt/data/work-next/e2e-storage-sql/execution/execution-nodes/002-analyzer-sql-analysis-analyzer-demo-repository/core-evidence/evidence/sql-analysis-evidence.json",